{
  "schemaRef": "https://masterpiece-os.local/architecture-preservation-dna.schema.v9b.2.json",
  "brandKey": "jiuzhou-aesthetics",
  "category": "medical_aesthetics",
  "phase": "9B.2",
  "architecturePreservation": {
    "enabled": true,
    "weight": 0.7,
    "protectedElements": [
      "ceiling_language",
      "spatial_signature",
      "material_expression",
      "lighting_behavior"
    ]
  },
  "metadata": {
    "frozenAt": "2026-08-01",
    "frozenBy": "Space Generator v1.1 Phase 9B.2 Architecture-Preservation Calibration",
    "sourceArchitectureAnchors": ["JZMX-ARCH-01-ReceptionMembrane", "JZMX-ARCH-02-EntranceGlass", "JZMX-ARCH-03-ConsultationFacade"],
    "notes": "Phase 9B.2 §4 JZMX 建议 weight=0.7 (强保护). 4 protected elements 全开, 因为 Phase 9B 给了 3 个 anchor 都有 ceiling_language + spatial_signature + material_expression + lighting_behavior 四个机制, 必须全保护. ceiling_language 重点: 膜天花 / 边缘光带 / 顶底发光缝 (JZMX-ARCH-01 标志). spatial_signature 重点: 膜天花 + 弧形玻璃幕墙 + 半透明隔断节奏. material_expression 重点: 微水泥 + 木材 + 半透膜 + 玻璃 4 类. lighting_behavior 重点: 主光 + 边缘光 + 紫色 ambient + 自然光 4 层."
  }
}
